xid,Project name,Review
R395606,Maple Sky Residences at Navins Starwood,"I can see that there is an Oil Factory near this apartment. Wanted to know if there is any impact due to this factory such as air pollution,."
R395606,Maple Sky Residences at Navins Starwood,Its all hunky dory in the ads but when it comes to reality as a buyer you are left hanging and you dont even get access to the club house. Buyer beware!
R395606,Maple Sky Residences at Navins Starwood,Nice apartment and patient with answering questions. Smooth buying process.
R395606,Maple Sky Residences at Navins Starwood,"Spacious appartment, but maintanence is very high."
R395606,Maple Sky Residences at Navins Starwood,Navins starwood Tower in Medavakkam Excellent construction and amazing infrastructure
R395606,Maple Sky Residences at Navins Starwood,Very good customer service .. the finishing property looked clean and good. Handover and registration was a smooth process.
R395606,Maple Sky Residences at Navins Starwood,"Nice ambience and good VFM, nearby to IT corridor and Vandalur new bus stop. Accessible to GST road."
R395606,Maple Sky Residences at Navins Starwood,We are really happy to have received a Dream House with Navin's Housing.....Thank You so Much Team....!!!
R354172,Shapoorji Joyville Sensorium,"Total Fraud by Shapoorji. The Foul Smell from the Garbage Dumpyard is Unbearable!! * This place is nothing short of a nightmare. The garbage dump yard located right at the society’s entrance. The smell is absolutely horrible, and it’s impossible to ignore. * Every day, dozens of trucks bring garbage from Maan and Hinjawadi and dump it here. They’ve tried to hide it by putting up barricades, but the odor can’t be hidden. * The so-called riverfront view they advertise is actually a big sham. It is impossible to take a walk in the society and it's always smell like a gutter. Imagine your 1.5 CR+ investment and you are living in a gutter. * The builder is not taking any action despite multiple complaints from residents and owners. What’s worse. This pathetic builder is even sending notices to the people who are exposing this scam. * To make matters worse, some of this garbage is being dumped into the nearby river, which is also the water source for the society. Can you imagine how polluted the water is?"
R354172,Shapoorji Joyville Sensorium,"Flat Buters are buying drinking water at the gate from outside agency why don't know . Common facilities like Recreation Hall and other facilitues may take more than 7-10 months to complete it seems. At the time of booking, very attractive promises were made to me like i will get Rental for my 2 BHK approx.ly 30,000 to 32,000 by Joyvilley concerned dep't. But after getting possession ladt week , found that Rent of Rs. 23,000 to 25,000 is not possible to get even after providing by me -buyer (not by Builder ) kitchen Trollies, Fans etc. In flat my flat. Furget about getting Rental equal to E.M.I. Installment Amount . Feels Cheated !!!!!!!!!!"
R354172,Shapoorji Joyville Sensorium,Good project of shapoorji pallonji Few towers construction is completed Total 9 towers are there Construction speed is good and they maintained complet transparency with monthly construction updates
R354172,Shapoorji Joyville Sensorium,"We are deeply disappointed that the local authorities are establishing a dumping ground next to our society towers, and the builder is not taking any action. This poses serious health risks, environmental damage, and decreases property values. I urge the builder to intervene and find a better solution."
R354172,Shapoorji Joyville Sensorium,"Very nice project and view , loved the view , it’s heaven to live there . whatever has been shown in brochure has been delivered in realty .. happy for the quality and timely possession . Commitment has been delivered by Shapoorji, Thank you team Shapoorji "
R354172,Shapoorji Joyville Sensorium,My experience with Shapoorji Pallonji Joyville has been smooth and satisfying. I highly recommend them to anyone looking for a trustworthy real estate developer with a strong commitment to quality and customer service.
R354172,Shapoorji Joyville Sensorium,"#rude staff""The property is decent, but the customer service is absolutely third-rate. The entire team lacks proper training, showing a lazy and unprofessional attitude. It makes me wonder if this poor service culture starts from the top, allowing middle management to get away with such unacceptable behavior. It seems like the management or owners are completely unaware of how their brand image is being damaged."" ""The staff is unable to answer calls, showing a lack of basic customer service. This reflects poor management and a serious gap in training. Extremely disappointing experience."""
R354172,Shapoorji Joyville Sensorium,The overall experience with the Shapoorji Pallonji Joyville Sensorium is fabulous. Very smooth procedure since booking to delivery. Special thanks to CRM Miss Sarita!
R354172,Shapoorji Joyville Sensorium,"I visited Vanaha Golfland by Shapoorji Pallonji today and trust me, the flats have got the most beautiful view! Surrounded by greenery from all over, their flats are super spacious as well! Really looking forward to investing in this project."
R354172,Shapoorji Joyville Sensorium,"Thanks to Joyville Sensorium Team to handover our dream home timely and a special thanks to Sarita Gurung she is very helpful and gave transparent update, Thanks Sarita you are so Good."
R354172,Shapoorji Joyville Sensorium,"We recently took possession of our flat in Ambrosia, Sensorium. We found superiour build quality of construction, and some smart construction done so that not many pipes are visible. Mosquito mesh are provided which was not part of innitial deal. Overall looks good ."
R354172,Shapoorji Joyville Sensorium,"After visiting the project, I can say it offers everything you need for modern living. The amenities are great, and the location is convenient. I think it’s a comfortable place for both families and professionals."
R354172,Shapoorji Joyville Sensorium,"Very disappointed with the garbage dumping yard just outside the society, the stench is unbearable. SP is just buying time instead of solving the problem. Gram panchayat is useless, the people who are supposed to protect the environment are destroying it. Imagine this water would be supplied to residents. People who are buying flats here paying a crore or more of their hard earned money, BEWARE"
R354172,Shapoorji Joyville Sensorium,Heavy foul smell due to the Big Garbage Dump yard right at the gate of Society. This has created bad experience for residents. Unfortunately builder is not doing much.
R354172,Shapoorji Joyville Sensorium,It was nice experience with Shapoorji and Palonji starting from the first visit till possession. Everyone was quite cooperative and helpful
R354172,Shapoorji Joyville Sensorium,I love the nature and I found the perfect property to feel connected to the nature...Vanaha Glofland by Shapoorji Pallonji is surrounded by greenery and their flats have beautiful views! It might have just become my favourite site!
R354172,Shapoorji Joyville Sensorium,"Joyville Sensorium is perfect. The location is convenient, and the amenities provide everything needed for a comfortable lifestyle. The property also has extensive green spaces and recreational zones, which my family loves. It’s a great investment."
R354172,Shapoorji Joyville Sensorium,It's shame that I need to reduce 5 Star rating to lowest rating possible just cause of recently made garbage dumpyard near by society. It's becoming very smelly everyday and difficult to live. 'Joy' in Joyville is getting replaced by 'Garbage' resulting Garbage ville and SP administration is least bothered about it. The ultra luxurious homes with all premium amenities are being downgraded just because SP is totally ignorant about this dumpyard and it's hazardous impact on Joyville residents. What an ultra luxurious shame..??
R354172,Shapoorji Joyville Sensorium,I’ve been eyeing Joyville Sensorium for my next investment. Its location is perfect for both families and professional. And the amenities are top notch!
R354172,Shapoorji Joyville Sensorium,Recently got possession of my apartment.Journey from booking the flat till getting handover was awesome. The construction quality of Shapoorji is something that I have always vouched for. Thank you for keeping your promises and going beyond that.Kudos to your internal teams specifically the CRM team.
R354172,Shapoorji Joyville Sensorium,"Vanaha Golfland is an amazing place to live. The greenery and peaceful environment make it stand out. The amenities are excellent, and it’s well-connected to important areas."
R354172,Shapoorji Joyville Sensorium,Convenience is at its best at Joyville Sensorium! Visited the property today and loved it's location and the flats! Booking soon...
R354172,Shapoorji Joyville Sensorium,I visited this property today and i absolutely love the fact that it is so near from the main Pune!! All the roads are well connected and its easy to reach there
R354172,Shapoorji Joyville Sensorium,Joyville Sensorium is a great choice for anyone working in the IT sector. It’s close to Hinjawadi and offers excellent amenities. The peaceful environment makes it a relaxing place to come home to.
R354172,Shapoorji Joyville Sensorium,The unit is as it was promised at the time of booking. The quality of work seems to be good. No leakage or seepage was detected. The view from Ambrosia will have the sunken garden and then the river. I was happy to see that they have actually kept a lot of space (as advertised) for the sunken garden
R354172,Shapoorji Joyville Sensorium,Visited Sensorium by SP yesterday and really loved the flat arrangements! The flats are very spacious as well!
R354172,Shapoorji Joyville Sensorium,Pune has a lot of projects but one caught my eye with its amazing amenities and great location!
R354172,Shapoorji Joyville Sensorium,Just visited this property in pune and its truly mindblowing! the surroundings are really good and the area is very well planned!
R354172,Shapoorji Joyville Sensorium,Vanaha Golfland has the most exquisite flats and the most extraordinary view!! I visited the property yesterday and can't stop talking about it to everyone!
R354172,Shapoorji Joyville Sensorium,The area and the campus is well planned...theres a lot of space to enjoy the environment at Sensorium.
R354172,Shapoorji Joyville Sensorium,"This project offers everything you could want in a modern residential development. The amenities are abundant, and the location is perfect for easy access to the city’s major areas"
R354172,Shapoorji Joyville Sensorium,Joyville Sensorium offers well-planned amenities and a location that’s ideal for families. It’s a great choice for those looking for a comfortable lifestyle in Pune.
R354172,Shapoorji Joyville Sensorium,Joyville Sensorium offers a convenient location and well-planned amenities. It’s a project worth looking into for anyone wanting to settle in Pune.
R354172,Shapoorji Joyville Sensorium,"Very nice project , a unique concept and project no issues of water and electricity at all , location is very commutable i just love this project"
R354172,Shapoorji Joyville Sensorium,"I pass by this project a lot of times a week, and I have observed the construction very closely. The quality looks amazing, and the apartments are very well-designed. I personally recommend this project to people looking for a project that has amenities for children, too. It has amenities for every age group."
R354172,Shapoorji Joyville Sensorium,"Joyville Sensorium is well connected to all major areas of Pune, making it a convenient option for city dwellers. The amenities are fantastic too."
R354172,Shapoorji Joyville Sensorium,The project is very beautifully built in a great location that offers convenience to the residents!
R354172,Shapoorji Joyville Sensorium,Too good man! I have been wanting to invest n a property in Pune and I think this is the one!
R354172,Shapoorji Joyville Sensorium,It was great being a part of Joyville group. Great experience.
R354172,Shapoorji Joyville Sensorium,"Please don't be fool with Marketing tactics.
1.It comes under gram panchayat, so lots of problem of Electricity and water.

2.Flat privacy is highly compromised by odd even terrace despite paying 97.3 Lakhs for 2bhk.

3.Go and ask any joyville resident they are not happy with there investment, no single owner is able to sell there house as no one wants to buy at this site.

4.Maintenance is high as water tanker comes frequently.
5.Project was is RED ZONE also due to extreme close to river.

6.No roads , no public transport connectivity, no shops near by.

7. No one knows the future but currently its for sure not a good investment."
R354172,Shapoorji Joyville Sensorium,"Joyville sensorium in pune has really caught my eye. The amenities are fantastic, and the location offers easy access to everything you need I am seriously thinking about investing here because it looks like it s going To be a gem in pune"
R354172,Shapoorji Joyville Sensorium,Sensorium is situated in a very nice locality and all the necessary stores are nearby..thinking of investing in a property here
R354172,Shapoorji Joyville Sensorium,"Very recently, I am informed that there is a serious issue with regards to health and environment. There is a dumping station due to which the smell is very bad, unhygienic and troublesome. SP has to urgently look in to this and ensure that it is removed immediately. It only reflects the poor quality of a reputed builder of the stature of SP. Hope SP will take immediate action and restore confidence of the residents."
R354172,Shapoorji Joyville Sensorium,"The amenities are wonderful, must check out this one if you are planning to invest!"
R354172,Shapoorji Joyville Sensorium,"Been watching this project develop, and it looks amazing so far! Excited to see the final result!"
R354172,Shapoorji Joyville Sensorium,This project by Shapoorji Pallonji is outstanding because of the nature and even more because of the spacious apartments!
R354172,Shapoorji Joyville Sensorium,"Sensorium is another mess same as Joyville ..overpriced , no amenities, high maintenance cost and moreover entire staff and FM team are corrupt and act like local goons . SHAME on SP . Wonder how people are giving 5 star here or paid reviews"
R354172,Shapoorji Joyville Sensorium,"The extensive amenities make it an attractive option, and the location is ideal for those who want to be close to everything in Pune. This is a project worth considering"
R354172,Shapoorji Joyville Sensorium,Overall fantastic experience. We took possession and found fantastic quality construction including the common areas and the fittings used inside the flat.
R354172,Shapoorji Joyville Sensorium,Those who like good amenities in society they should definitely go for this. Also those who want very less problems after getting flat and good service while leaving in society then this is good option. Also this builder handover flats before timeline. If we talk about other problems then forget about it it will be there everywhere. So I will suggest go for this.... 5* from my side for everything. Just small request to builder and management be as it as you are always. Thanks.....!!
R354172,Shapoorji Joyville Sensorium,"Our journey of homeownership via shapoorji was superb throughout. We were always helped along the way by their CRM team, and eventually we got exactly what we expected when receiving possession via the Shapoorji team."
R354172,Shapoorji Joyville Sensorium,"I am considering this project in Pune, very beautifully built!"
R354172,Shapoorji Joyville Sensorium,"This new project is coming up in a very convenient location that is close to all the major hotspots and the daily needs of the residents. It is by a very well-known builder, Shapoorji Pallonji Real Estate, whose projects never disappoint."
R354172,Shapoorji Joyville Sensorium,"The project seems designed with the modern resident in mind, offering comfort and convenience. It’s definitely one of the top projects I’m looking at"
R354172,Shapoorji Joyville Sensorium,"I am currently residing in this area. Listing the issues here - 1) ""Approach road to this society"" from Hinjewadi-Maan road (near HP petrol pump) is very bad. No Street light on this road, so unsafe for travel after 6pm specially for ladies and childrens.. 2) Frequent power cuts - very unreliable power supply. 3) Water supply issue."
R354172,Shapoorji Joyville Sensorium,Shapoorji Group is a brand that we can trust. Their projects are always top-notch and attractive. Joyville Sensorium by them is another amazing project with luxurious amenities. It offers great interiors and green surroundings that make it stand out from other projects in the locality.
R354172,Shapoorji Joyville Sensorium,Wanted to book but reviews changed my mind .I can't risk overpriced flat for life time problem. Builder must clear all light and water problems else any project in wagholi is better than this sp project.
R354172,Shapoorji Joyville Sensorium,We had a very good possession experience at Sensorium the staff was very polite and answered all our questions. It's more then value for money....keep up the good work.
R354172,Shapoorji Joyville Sensorium,"Don't go with the builder name, it's very inside projects and the buil quality is not good, there are lots of issues in the plot 1 joyville. They are. Just selling on the builder name nothing else, there is no single shop beside the project, no public transport. Even there is power cut issue even the water is came by tankers due to such bad water lots of health issues as well as everyone in the society having hair fall problem. Very bad experience i have ever had and the sales team also not good, don't buy here."
R354172,Shapoorji Joyville Sensorium,"in Joyville No water source other than river & tankers. In summer it will be hard to get water unless strong source from MIDC or Borewells are dug. Maan cant offer much water. Power shortage & frequent outage is another issue. this also needs to be attended by builder. Bad approch road n less no of street lights in rainy season also needs to be addressed Builder will have to use influence to get water from MIDC or Borewells. otherwise place will be hell in summer due to no water supply n many towers coming up. Please get other reliable source of water in writing in agreement. Concrete approch road from main road needs to be constructed by builders. For power, state govt needs to enhance capacity to provide uninterupted power."
R354172,Shapoorji Joyville Sensorium,Beauty at its finest. Would highly encourage y’all to invest in a place that offers you best of all worlds - from service to atmosphere. You wont regret it.
R354172,Shapoorji Joyville Sensorium,"Not even worth giving 1 star. Whoever is buying Sansorium, you are being fooled. You are buying pathetic property at a premium rate. Monthly maintenance is equal to rent of 1 RK ie 5k. I am an owner at joyville Hinjewadi which is situated just beside this so called another best project - Sansorium. Facilities to name few: - Very poor and savage management by SP - Power cuts more than 12 hrs - yellow and dirty drinking water - even no water for more than 15 hrs. - pathetic security To be noted that all other societies in the same location have better living conditions. SP has given a lame excuse of no permission for borewell though a nearby society has borewell. This is all happening currently and it has been only 1 yr since possession. Don't get fooled by good reviews. They are all brochure based."
R354172,Shapoorji Joyville Sensorium,"Be very careful while buying it. There's loads of power cut off, water is still provided by tankers. Such a hard water which will harm your health. Even for basic necessities you have to go almost 3 kms. Poor infra and worst maintenance team. I mean they don't allow delivery boy inside the main premises"
R354172,Shapoorji Joyville Sensorium,"No positive reponse from Builder. Only making false promises. Be very careful while buying it. There's loads of power cut off, water is still provided by tankers. Such a hard water which will harm your health."
R354172,Shapoorji Joyville Sensorium,"SP Joyville sensorium is a good future for future perspective for family perspective, sales representatives Jyotsana & Manish assisted in a beautiful and friendly manner and cleared all my queries. I booked last tower Helius and positive for future. One must buy here if you like peace and nature with all luxury amenities. Even MIS international school is opening in a walking distance. CRM Ruchira is helpful and always ready to assist me in any query."
R330371,Coco County,"COCO county is from the County group which has delivered some good projects in Noida. This project is quite conpact, kitchen is smaller then expected, club and swimming pool is maintained well"
R330371,Coco County,"An ambitious project from the well known builder ABA Corp. From the developer's of Cleo County, Cherry County, Orange County. spread in 4.5 acre. All the flats are of 1152 sq ft, 3 bhk. Although rooms are little bit small but it's okay. Build quality is very good. Total there are only three towers, which is good. The club is very beautiful.

I am editing my review after possession. Wasn't expected from County group for this third class project. Below are the observation:-

1. The hardware used in flat are not up to the mark. Compromised with the quality.

2. The behaviour of maintenance team is arrogant.

3. It seems you are a tenant in your home.

4. You are not allowed to do any changes in your flat. Like balcony covering, show rack outside etc.

5. Even the design of the flat is like, if you're not covering your balcony, anyone can jump and enter in your flat from corridor. Easily accessible. Security threat.

6. If you want to book club banquet hall then There are specified vendor, you are bound to go with them. Monopoly. You can not choose the vendor as per your choice."
R330371,Coco County,The quality of construction is great of this project. Location is great because of close proximity to Knowledge Park 5. Lots of amazing developments coming in sector-10 and 12. One of the best project in this area to invest.
R330371,Coco County,"Pros:
*good airy ventilation structure
*12 flat on each floor, 6 lift, each tower portion equally divided
*beautiful club and swimming pool
* 3 side open, hence no nearby building
* Easy maintenance and Mivan based building structure

Cons:
*compact sized 3bhk
* no public transportation nearby, only private cab, private cars, auto
*10 to 15 min drive away from big shopping malls
* restaurants 10 to 15 min drive away, but food delivery options available"
R330371,Coco County,"Great Project. Quality of Construction is Very Good.

Good size of 3BHK and very practical for a family."
R330371,Coco County,"In block B No sun i winter and partial sun in summer.... and full electricity problem.

During chaat they play music on full volume since early in morning don't know if they wanna worship or harras other residents...no order in society by few in considerate residents."
R330371,Coco County,"I have been staying in coco county since december 2023.
My experience in terms of maintenance and other services is good.
CLUB is highly maintained with gym and swimming pool.
Indoor play area is properly maintained.

Small commercial area with all shops like kirana shop,dairy shop,pharmacy,on call doctor,gift shop,restaurant,aata chakki are there and they get 99% of the routine things done.
2 good quality Unisex saloon are there.

Park,parking and outside area is neatly maintained.

There was some issue of electricity in initial 2-3 months.
Because of some technical glitch.

But it has been solved and also there is a back up and me personally have not faced any issue.

Blinkit and zomato works.
Nearby doctors and other requirements including hospital is there.

ONLY NEGATIVE IS-
Compact size 3 bhk....
But if you have a small family 3-4 person
Can easily manage.

Construction quality- GOOD??

LIKE ANY OTHER PLACE....SMALL ISSUE HAPPEN EVERYWHERE.

MY EXPERIENCE with county group.
In terms of all White payment.... Registry process was smooth.

I haven't paid a single penny in cash.

So DECENT EXPERIENCE."
R330371,Coco County,"Premium Society

Everything from the starting entrance and Rooms are Epic ????.

Swimming Pool was just like a Wow
Gyms / Puja Mandir everything.

Only issue with The Location ?? - It's good but in totally Side ????/ Not safety during nights especially for girls and all if working or self travel"
R330371,Coco County,"Highly unprofessional team. no one cares about investors queries specially after all dues in account, specially their finance and CS team. Invest only if you have ample time to visit the site for small inquiries.Such a painful experience of my investment"
R330371,Coco County,"Builders and brokers are creating hype in Noida. Government should check these things. They are playing with middle class money. They put out of stock and brokers sell on high resale prices. In pre launch suppose 6k sq feet and every 3 months they revised the prices, in construction phase 10k,15k then resale. Trapping the peoples. Don’t trust Noida builders.In Noida extension, metro didn’t even started and they increased price like anything.adding luxury and ultra Luxury fancy words to make innocent people’s fool."
R330371,Coco County,"As usual, quality product delivered from county group. All facilities like maintenance, tower receptions etc are better than any other same tier society.
Overall a good investment for future as the area is already planned to be developed soon."
