xid,Project name,Review
R330371,Coco County,"Builder is reputed but society have 3bhk room size 10x10, not good but still good for budget. County group is best for its construction quality. And design of society some more famous project is Orange county, County107, Cherry county, and some more projects in noida, noida extenstion and some project in ghaziabad indirapuram."
R330371,Coco County,"So much Fraud going here. Asking appx 40-50% in cash. Be safe and don't fall in the trap.
Builders and brokers are creating FOMO in this sector. Beware..!!"
R330371,Coco County,Construction quality is good but layout very bad and maintenance not good as per County group compared to other projects. Dheele log bitha rakhe hain maintenence main Saare.
R330371,Coco County,Extreme compact flats with 10*10 sq ft layout is not so good for family. Rates are too high acc to locality. no population nearby no shops even roads are also not developed.
R330371,Coco County,Club is maintained by County group that is only good thing here. Maintenance is not able to take appropriate decision and always influenced by some residents which is going to deteriorate the County group reputation.
R330371,Coco County,"Extremely compact apartment Located in Sector 10(Affordable housing sector) This was supposed to be the part of Affordable housing scheme but 99% apartments were sold to Investors and these investors are asking upto 88lac for the apartment which has carpet area of 639sq feet only.

What's the point of launching as an affordable house if these builders are going to sell the entire society to investors instead of common people. This isn't the only property in this sector, it's the case of all the properties in sector 10, arihant, ATS all are mostly on resale by investors who are asking over 80lac for these compact apartments."
R330371,Coco County,"Most Unprofessional team..CRM team thinks they are owner of group or like God. They are so rude and shout like anything.
Ayushi is the person i was talking too. Never listens and understand customer grievances. Even after making a handsome amount of payments no confirmation via mail or call from team. you call them and they shout like anything. Neha doesn't even have the courtesy to pick up the phone/call back/message for even trying her number for more than a month. Need some different person in place of ayushi. HIGHLY UNPROFESSIONAL TEAM"
R330371,Coco County,"Negatives
1. Loading is very high out of 1152 sq ft only 644 sq ft carpet area.
2. Sector 10 is not developed yet not even a single kirana shop in the whole sector forget about other shops.
3. Road in front of the project becomes a swimming pool during rains.
4. Half of the flats will not receive any sunlight.
5. Small apartment with small kitchen and bathrooms.
6. Almost zero green area , no Central park.
7. Farmland behind the project, nobody knows what will come behind it.
8. Greedy builder , stopped transfer of newly delivered flats.
9. High rate , in the same rate you can get apartment in heart of Noida extension.

Positives
1. Mivan based construction
2. Construction seems solid.
3. Name of builder"
R330371,Coco County,It will be long risky bet if anyone buys home in here. The amenities and facilities are from reach.
R330371,Coco County,Well managed Society. There is a green belt right in front of the Society. Also they don't allow guest vehicles inside.
R330371,Coco County,I have booked there too. I am excited about the same. I did my home work and also asked people who are living in cherry county and cleo county. As of now the project looks like a little further away from noida extension buzz but I’m sure that also makes it a good investment for future.
R330371,Coco County,"Team are not at all professional.. They are extremely rude and never listen to their clients.
I want to escalate the behavior of Nikita as she's the one who always talk unprofessionally and very rude to everyone. Never come back with the solution, never guide their clients and when asked she shouts like anything. Please take action regarding her behavior."
R330371,Coco County,"Fake Project on the name of ABA County Group
Un-Professional Sales persons and Rude approach .
Beware of this project
Location is not good and is risky as so far and inside from main road
Room and hall sizes are so small
3BHK offering in 1150 Sqft ????
Saying Possesion is in Dec2022 but they may not be able to offer ready to shift in yr 2023 infact .
Beware , Beware Guys"
R330371,Coco County,Worst only selling buider name room size is not good. They are sold out tower a at price somewhere around 56 lac no wooden work in kitchen close to surajpur.very far
R330371,Coco County,"So far the property is good. Good construction , decent fittings in washrooms. well lit rooms. However the kitchen is small to place a fridge and to cook."
R330371,Coco County,Nice location to buy a flat in Greater Noida West. Peaceful environment and relaxing surrounding. Connected to Noida -Greater Noida link road.
R330371,Coco County,The sales terms of coco county is worst in team of knowledge they didn’t interested to sell there unit even they don’t know how much inventory is left in the project so kindly avoid or ur trapped
R330371,Coco County,Newly constructed small society with all the facilities. Only drawback as per me small kids play areas.
R330371,Coco County,One of the best locations to buy a house if you looking for peace of mind..few things which could be an issue is ..no public transport..
R330371,Coco County,Carpet area is too small compared to premium price. Room size are so small that you cannot place double bed else there will not be space in the rooms. All in all useless to invest....
R330371,Coco County,Good construction quality. Best services in town as per their customer satisfaction.
R330371,Coco County,"This builder is very reputed, anyone can book here without a second thought. Please dont go with any negative reviews."
R330371,Coco County,Nice society but hard to reach if untill unless have own conveyances.
R330371,Coco County,Well planned and beautifully designed with well ventilated all flats.
R330371,Coco County,One of the best project of the location for future as anticipated through the track record of builder.
R330371,Coco County,This place is still under construction and club is in developing stage
R330371,Coco County,"Sizes are same in society but as per area that is very conjunction
Not good format
Compramise with the area and looks"
R381477,THE ANANDA,Worth every rupee. It would have been more friendly for senior citizens and differently abled/ injured if some ramps were provided instead of stairs near the amenities.
R381477,THE ANANDA,Very well designed.the club house and the flats had beautiful finishing. It's just lacking some supermarkets n medical shops
R381477,THE ANANDA,Worst Rules and bad management. Even if we have our own property living like Jail or Gosha... Dnt ever purchase this Jail House.
R381477,THE ANANDA,Nicely constructed Quality material used Beautiful building Great Location Trusted People Very cooperative staff Satisfied being Anandian ??
R381477,THE ANANDA,Very good location and good quality construction and management is committed to give what they are promising
R381477,THE ANANDA,Excellent Construction in a great location. Value for money.
R348973,Peninsula Parkelite Phase 3,"Recently visited. Budget villas. After research, got to know that builder is not at focusing on developing the club house or amenities they are promising."
R348973,Peninsula Parkelite Phase 3,"In the world of fraud and cheaters builders, I find Peninsula infra very reliable and honest, CRM team and Srinivas from sales team are very helpful , PS: this is not a paid review,
I am generally not very modest about reviews"
R348973,Peninsula Parkelite Phase 3,"Nice place
Not high cost compared to others"
R303861,Piramal Mahalaxmi,"Company replied today to my review posted a week ago, that my concern has been attended is again a big lie, no resolution has been offered by Piramal. Booked an apartment in Mahalaxmi with Piramal. At booking, they promised flooring selection options—marble samples were even displayed. Now they’re backing out, asking for written proof. Disappointing to see a brand like Piramal go back on its word."
R303861,Piramal Mahalaxmi,"Piramal Mahalaxmi -a magnificent project to live in the south Mumbai offering the cinematic views of the Mahalaxmi racecourse and the Arabian sea. The Central tower positioned at its best in order to the excellent offering of Piramal Mahalaxmi as it gives eventual privacy by having 4 residences at each floor with a scenic view of south Mumbai. This flourishing & progressive project, with its hustle & bustle of the streets, rich traditional culture elucidates the charismatic fusion of past to present. Piramal Mahalaxmi is the Largest Residential Project in South Mumbai, with over Development of 2 million sq ft, it will have high rise towers which will have Uninterrupted Views of 225 Acres big Mahalaxmi Race Course & Arabian Sea. Piramal Mahalaxmi project is well connected to the rest of the town, the location is close to Mahalaxmi Station, Roads, and upcoming Metro and Monorail Projects."
R303861,Piramal Mahalaxmi,"After Sales Service is a big miss and no one will attend and every one will try to avoid calls. There is no transparency in their pricing. Merciless management on any request put up after registration of the flat and after clearing the payment. Your answer is not correct. Pls do not justify. Your team has not picked up nor responded. Only after sending mail to Mr Ajay Piramal, got a call and justified the charges. Let the world know how come you can level interest for 3 days wherein 98% of the total cost has been paid?? Which builder will cheat and level like this in India or around the world?? Nitish Rodrigues was my CRM. He used to respond and answer only for payment. He always avoid my calls and meeting. Nowadays he blocked my no after getting 98% of the payment 2 yrs before the possession. Pathetic organisation."
R303861,Piramal Mahalaxmi,"It's Landmark of Mumbai which will come in next 4 year, very good apartment for residents"
R303861,Piramal Mahalaxmi,"Upto now, the entire experience has been great. Going forward, i believe the location will be amazing as this project straddles south mumbai with the suburbs. With the upcoming developement on the Mahalaxmi racecourse and the breath taking sea view, i believe i have made a good investment banked by the Piramal reputation and backed by an excellent support team with special mention for my rm Nitish Rodriquez who even answers my queries on holidays as i am based abroad. Thank you Nitish for bearing up to me."
R303861,Piramal Mahalaxmi,"Very dissapointing . They took 5 lakh token to book with promise that if the deal is cancelled then they would refund the money in 30 days. Appalling to see that such a big company cannot eveb return such an amount on time even after 3 months as that deal didnt go through, as if they cannot pay back 5 lakhs what they will deliver the product on time.I would advice to avoid dealing with them and being very cautious when it comes to money. The dont even respond to phone calls. Hopefully I get back my deposit"
R303861,Piramal Mahalaxmi,Piramal mahalakshmi is very best project last sunday i went there for a meeting. Heritage dhobi ghat in front and beautiful race course view from middle floor. Buying a flat in piramal mahalakshmi will be a fantastic experience budget friendly option in south bombay.
R303861,Piramal Mahalaxmi,Have always had a very efficient and meaningful response from my relationship manager Jyoti Shah. The organisation has conducted business in a very professional manner and that has made me invest confidently.I have not seen the work in progress so unable to comment on quality and value. Keep it up and look forward to the early completion of the building.
R303861,Piramal Mahalaxmi,Nice project and expect some great views of the race course once it is completed. Challenge is the narrow roads around the building and the nearby fish market. Seems this will change as per the new development plan for the area. But considering the slow pace of things in India for infrastructure updates one can’t really be sure
R303861,Piramal Mahalaxmi,"Very friendly staff.. show flats are beautiful Neitu attended to us, she was a absolutely professional and was on top of her work. Even waited inelegant for us at 6pm as we wanted some more information. One of the best experience we have had with builders This is a beautiful project and we will invest in a flat here"
R303861,Piramal Mahalaxmi,"One of the most promising project in South Mumbai with a brand name you can trust. All modern amenities, infinity pool etc. with apartments offering uninterrupted views of the Bay. Loved the overall site experience. Team was super helpful and informative."
R303861,Piramal Mahalaxmi,Cliffford is best and he made my things so easy I too can’t believe that I too couldn’t believe this was possible to manage and continue the sale. He is the best he understands the suitation of the client and believe in resolving it by finding solutions . He made my life easy where I taught which was impossible to continue my deal he made it so easy . Thanks once again to him. He is very active and responsive.
R303861,Piramal Mahalaxmi,"Always quick in responding and providing clarification, ready to run an extra mile and get information for the clients. For Nitish client is at top priority, we are very impressed with Nitish and service he offers to the client. Infact one of the biggest reason for us still with Piramal is Nitish, as he makes processing so smooth and easy."
R303861,Piramal Mahalaxmi,"Had a great experience at the sales centre, the team was very well spoken and explained the details clearly. The project is super luxurious and definitely worth considering. The location and views look good, best for self stay."
R303861,Piramal Mahalaxmi,"If we are proud owners of units in Piramal Mahalaxmi, it is due to the easy, pleasant and convincing attitude of Nitish Rodrigues, our Relationship Manager. His cheerful demeanour since the first contact and prompt response to every query and request over the last three years is a mark of high professionalism and commitment he brings to his duties. His untiring efforts have definitely served to Build Trust in brand “Piramal Realty” as one that Always Delivers. Our Compliments and Best Wishes for Greater Success"
R303861,Piramal Mahalaxmi,"Please please dont ever think of buying a property with Piramal. Very unprofessional and non-responsive. I went to see their Mahalaxmi property on Dec 30, 2021. They asked me to pay some token if I wanted the exact pricing of any one flat and they said it is FULLY refundable in 30 working days. I paid them Rs. 3,00,000/- since I wanted to figure out the exact pricing and I was almost keen to go ahead. Then After 10 days, on Jan 10, 2022 I already informed them that I did not want to go ahead due to a family emergency. It is now 1 month and more than 30 working days since I have been following up with them to return the token amount. Very slow, very unresponsive and unprofessional. Infact they should be paying me interest on the same. Pls dont ever deal with the group. So what if its Piramal or Ambani - all big robbers"
R303861,Piramal Mahalaxmi,"Wonderful Experience..They are great at providing the right experience to their clients..Everything was so transparent and trustworthy..They explain it so well, also very good at solving queries of their clients..Their manager Rajan Singh was very professional and supportive..Marketing team was also very supportive..It was worth visiting there.."
R303861,Piramal Mahalaxmi,Beautiful sales gallery and the managers are qualified professionals. It's a luxury project facing Mahalaxmi race course. Connectivity is nice too.
R303861,Piramal Mahalaxmi,Jyoti Shah is a highly professional individual and is extremely knowledgeable. She has been able to assist with accurate information and speedy help in resolving questions and issues whenever needed.
R303861,Piramal Mahalaxmi,You Mumbai people are awesome. So I'm giving a 5 star for no reason. But the apartment pics look amazing bro though! Ya gotta get me a flat in yo apartments.
R303861,Piramal Mahalaxmi,"Best location in Mumbai, Brilliant elevation good enough to stand out in the key skyline of Mumbai, surely will be a landmark in itself ... and amenities facing the racecourse & sea making its pool & landscape infinity ?? …"
R303861,Piramal Mahalaxmi,"Piramal Mahalaxmi are absolutely great at providing just the right experience to their clients. Other than that, I was precisely attracted by the stunning view from the property we visited."
R303861,Piramal Mahalaxmi,Visit this place which is very near to the mahalaxmi station.....3 towers of 63 storeys are constructed at this plot of 4.3 acre.....the USP if the project is the full view of the race course and the Arabian sea.....2 BHK property cost here is whopping 3.63 crore....
R303861,Piramal Mahalaxmi,Very very bad experience!!!!!!! I am still waiting my EOI money have asked for refund 45 days back and have been calling them every day ...... not even a single mail NOT EVEN A AUTO GENERATED . The sale executive Devika shamelessly doesn’t answer my calls. The office team has been just saying we will get back. Is this how Piramal stay by it’s Brand name !!!!!!
R303861,Piramal Mahalaxmi,It’s been a pleasure to have visited Mahalaxmi Piramal. Mr. Nitish especially has been of great help. It has been such a pleasant experience to deal with him.
R303861,Piramal Mahalaxmi,"Most desired project in south Mumbai, over looking Arabian Sea and racecourse. Great location and value of 3&4BHK."
R303861,Piramal Mahalaxmi,Most Iconic location with amazing race course and sea views. Lovely sun rise and sun set.
R303861,Piramal Mahalaxmi,I'm a Channel Partner for Piramal & I really loved the project. The view that it will provide will be mesmerising. It has a Luxe Class.
R303861,Piramal Mahalaxmi,"The views of the project are amazing, with a good quality of construction and CED team is extremely very helpful at the site ."
R303861,Piramal Mahalaxmi,"Good response, very careful attending with responsibility to Customer n Channel Partner.. Specially #AbhishekhChandak & CED Team Office Boy Omkar Shinde.. Very Satisfied."
R303861,Piramal Mahalaxmi,Amazingly customer friendly site. Superb interface for clients to get the project understanding
R303861,Piramal Mahalaxmi,It's on a construction site. Near Kasturba hospital & Author Road jail. Heavy traffic area. Mono railway station nearby.
R303861,Piramal Mahalaxmi,Amazing project with mind blowing views. Their sales Gallery is also amazing.
R303861,Piramal Mahalaxmi,"Excellent Location, premium project, GREAT GREAT GREAT VIEW."
R303861,Piramal Mahalaxmi,"Humble staff, good project coming up in sobo"
R303861,Piramal Mahalaxmi,Very beautiful place looking like a cinematography
R303861,Piramal Mahalaxmi,Good Project but location is still not that Good
R303861,Piramal Mahalaxmi,Superb quality construction work
R343401,Kalpataru Parkcity,It's very poor service management. Kindly hire traind staffs. My bags was stone. The secretary guard not aware of this.
R343401,Kalpataru Parkcity,Well planned besides being open with buildings being well distanced.
R343401,Kalpataru Parkcity,The builder does not allow customers to visit their own homes while it is being built till they collect the last rupee. Different customer representatives all for money without proper documentation and in their own account. The project was significantly delayed even though it was Rera registered. Customers could not opt out without losing money. I strongly suggest starting away from this builder.
R343401,Kalpataru Parkcity,Went there for a event Amazing property One of the premium locality
R343401,Kalpataru Parkcity,"The scenary was amazing and was worth for the entry fee Taken by the management cleanliness was also there but there wasn't any food court or souvenir shops only water stall was there and it wasn't also chilled many shops were under construction it is very far from Thane Rly Stn and bus connectivity is also not frequent and after 7pm while returning if the bus comes then also crowd is too much many people hang on the edge of doors it is also not possible to go in that If you have a car and planning for a photoshoot it is the best but by public transport it is little bit hard to reach there or you can also book ola, uber or local taxi or auto"
R343401,Kalpataru Parkcity,"Many beautiful playgrounds for kids, a beautiful pond. Weekends are very full, weekdays after 4pm is the best time to visit"
R343401,Kalpataru Parkcity,if there a rating below 1 would have given that useless builders there customers service is at worst level always say will call you back in 5 min and that never happens no clarity avoid there projects
R343401,Kalpataru Parkcity,The project plan is amazing grand but the service is worst .. They are terrible .. no fixed CRMs they keep changing . They wil show big dreams but will shatter . We booked a flat and are really stuck .. they connect to you when they need to raise demand . Their new system of hi is absolutely waster they close the case without giving a call back . Delayed possessions . They told us first that people will have access to the grand Central Park and sold the property the previous CRM said it’s not the case . We need to pay for it .evrytime you speak they possession date changes
R343401,Kalpataru Parkcity,Best industrial area for visit and and garden are available for childrens and couples best natural theme
R343401,Kalpataru Parkcity,Had a wonderful experience at Kalptaru Immensa today. Thanks for the warm welcome. A place with lot of open spaces and lush greenery. Thanks to every one for making this moment very special for us.
R343401,Kalpataru Parkcity,It was a wonderful experience all throughout. Would recommend!!
R343401,Kalpataru Parkcity,"An absolutely unprofessional post sales approach , The crm team responds to no requests . Absolutely unbothered by what customer wants, zero empathy towards customer and only works as 0er their wimps and fancies unappauled by any escalations at any level. They will flip their words in 5 minutes be careful. The only 1 star is for the sales guy aditya who is tried to provide all help he could in his ability but a disastrous post sales experience , they have treated house buying experience worse than buying from street side shops"
R343401,Kalpataru Parkcity,"Experience so far has been great... Karan and Shivani were to the point, transparent and gave us a lot of comfort. Hoping for an equally smooth experience leading up to posession"
R343401,Kalpataru Parkcity,Good town planning. Booked my apartment in Eternia. Process was smooth and well organised. Karan Sharma is an excellent executive who understands your requirement and suggests the best project and plan. Eager to see how the work develops and completes in the given time. Kalpataru Parkcity - a dream home project
R343401,Kalpataru Parkcity,First visited Parkcity three years ago. Can see a huge difference between then and now. There is a lot of greenery and thoughtful planning. The Grand Central Park makes it lush green. Feels like a well-planned township with lots of space which is a rarity in Mumbai.
R343401,Kalpataru Parkcity,"Had gone to explore options in new project Eternia around 10 months back. Was attended by Ms Diksha who was very courteous, helpful and still continues to support. Same cannot be said of their CRM team though."
R343401,Kalpataru Parkcity,"Visited this place with my family, good project with great location really loved the design. met manager called Aniket Chilap thanking him with the knowledge and guidance he has provided us that has helped us to decide on location and project finalisation."
R343401,Kalpataru Parkcity,"Kalpataru Parkcity is an ideal choice for homebuyers looking for a blend of luxury and nature. The project offers spacious, well-designed apartments with top-notch amenities, including a clubhouse, swimming pool, gym, and children's play areas. Its vast green spaces and landscaped gardens create a serene environment, promoting a peaceful lifestyle. The location is well-connected, with proximity to schools, hospitals, shopping centers, and transport hubs, adding convenience to daily life. The project is also known for its strong security features, ensuring safety for residents. Kalpataru Parkcity promises a premium living experience with sustainable and modern infrastructure. I received excellent customer service and was impressed with the personalized attention throughout the process. The team was responsive, attentive, and made sure all my questions were answered promptly. What stood out most was their commitment to offering the best pricing options. They went out of their way to ensure I got the best deal, providing transparent and competitive pricing with no hidden costs. The entire experience felt smooth and stress-free, thanks to their professionalism and clear communication. Overall, it was a perfect blend of great customer service and unbeatable pricing, making me feel valued as a client."
R343401,Kalpataru Parkcity,Ayushi from sales team was very helpful in accommodating what I was looking for. Also to mention Faraan who helped me scout the property.
R343401,Kalpataru Parkcity,loyalty manager alisha was helpful with the pricing and gave extra discount . Also the manager explained very well and make sured the client is getting comfortable first.
R343401,Kalpataru Parkcity,Excellent project with greenary. Sales person is very cooperative and explained very well
